,Job_title,Company,State,City,Min_Salary,Max_Salary,Job_Desc,Industry,Rating,Date_Posted,Valid_until,Job_Type
16,"Data Analyst, Content",The Athletic Media Company,CA,San Francisco,61453,91080,"About UsThe Athletic is a direct-to-consumer digital sports media company committed to helping subscribers experience storytelling in a whole new way. Founded in 2016 and headquartered in San Francisco, The Athletic has more than 575 full-time employees and covers more than 250 professional sports and collegiate teams in the US, Canada and the UK. The Athletic’s newsroom has produced thousands of in-depth articles along with more than 120 podcasts and premium video content.About this JobWe are looking for a data analyst who can identify the types of content that resonate most with our readers and deliver these insights to our editorial and marketing teams. Our ideal candidate will combine their intuition for great sports content with a strong, data-driven approach to measure and contextualize the value of different story types to our subscribers. Our analyst will work very closely with our editorial team to deliver insights on what’s working and what can be improved with our product.ResponsibilitiesContent Tagging: Read, research, and tag all of the content produced by The Athletic with characteristics about the article. Content Insights: Analyze all of our content to understand what resonates with our subscribers. Editorial Support: Work closely with our writers and editors to answer any questions that they might have about the engagement of their work. Communicate Insights: Deliver contextualized insights to our editorial team to improve our product.About youBachelor’s Degree in Statistics, Machine Learning, Computer Science, Mathematics, Economics or other quantitative field 1-3 years of prior experience in a data scientist or content analyst role Extensive knowledge of professional/collegiate sports and the sports media landscape (NHL, NBA, MLB, NCAA, NFL, Soccer, etc). Ability to read through articles across all sports and identify characteristics for each story. Ability to consolidate findings and communicate analysis to editorial team in an easy to understand manner. Must be proficient in SQL and Excel. Experience in Python, R, or another scripting language Ability to multitask and self-manage projects. Zero fear of failure and the ability to quickly ramp up on new projects. Comfortable dealing with ambiguous, open-ended problems Ability to remain objective and deliver constructive analysis Ability to meet tight deadlines in a fast-moving start-upThe Company is backed by Founders Fund, Evolution Media, Courtside Ventures, Comcast Ventures, Bedrock Capital, Advancit Capital, Y Combinator, and other leading investors. The Athletic is headquartered in San Francisco, California. The Athletic was awarded a 2020 Great Place to Work.The Athletic Media Company is an equal opportunity employer and enthusiastically encourages people from all backgrounds and experiences to apply. The Athletic will consider all applicants without regard to race, religion, color, national origin, ancestry, physical and/or mental disability, medical condition, genetic information, marital status, sex, gender, gender identity, gender expression, transgender status, age, sexual orientation, military or veteran status, or any other protected characteristic under applicable law.",Media,4.4,2020-04-25,2020-06-05,FULL_TIME
17,Senior Data Analyst,GSN Games,CA,San Francisco,106259,132890,"
GSN Games, the leading developer in mobile and social games, is seeking a Senior Data Analyst with a passion for problem-solving and real world application to join our casual games studio based in Palo Alto or San Francisco.

About the GSN Casual Games Studio: 
Our studio consists of a talented group of game artists, designers, engineers, product people and marketers who craft industry-leading mobile games providing very high quality experiences. This studio is the home of Solitaire Tripeaks by GSN, the #1 revenue solitaire game on mobile that has quickly grown into one of the top grossing games on both iOS and Android.
What You’ll Do:
As a Senior Data Analyst in our Analytics group, your goal will be to help the team understand the most important behaviors of our players. You’ll use problem-solving skills, sound logic, and data tools like SQL, in order to identify and evaluate trends, determine real value of team initiatives, and clearly communicate results and outcomes. You’ll work with the entire team and provide analytics grounding to business decisions we make every day. You’ll learn our tables, do ad hoc analysis as requested, help our team figure out what they really should be asking, create dashboards where needed, and generally use our data to be the real backbone of our data-driven culture. Most importantly, you’ll use situational awareness to make sure you understand our game, our funnels, our current KPIs and our player behaviors to make sure that your analyses make sense and help the team learn.
You Will:
Work with product, live ops, game design, engineering, marketing, DBAs and other teams to deliver actionable insights into our games in order to improve our user acquisition, engagement and monetization, including creating and updating SQL queries and Tableau/Excel/Google Sheet dashboards
Design and implement new analytics events and queries for new game features, game events and player offers, to make sure the team gets the information they need to evaluate and improve the game
Design, implement, organize and analyze advanced statistical testing for specific problem-solving needs (e.g. A/B testing).
Identify problems, anomalies, trends, issues, and opportunities, by looking at the data and coming to your own conclusions
Answer business-related questions through exploratory data analyses and ad-hoc reporting.
Participate in data retention management processes, including defining and updating retention policies and creating/updating tables to optimize data analysis workflow and cost
About You:
BS or MS in Analytics, Business Intelligence, Finance, Statistics or Computer Science, or other analytical discipline
4+ years of experience as a data or financial Analyst applying statistical analysis to B2C consumer behaviors (mobile apps, advertising, market activities)
Outstanding problem-solving skills, including the ability to:
analyze situations and determine the best metrics for a situation
conceptualize player behaviors based on data
identify meaningful proxies of player behaviors where data doesn’t exist
Strong work ethic, intellectual curiosity, and drive to complete projects
Experience using SQL, including complex queries from multiple data sources
Experience creating, operating and analyzing multiple simultaneous A/B tests
Strong communication and presentation skills, including extensive use of chart and table tools
Ability to understand and act on changing priorities, and execute multiple competing projects based on business case and expected impact
Familiarity with data and BI presentation tools (Tableau, Excel, pivot tables)
Bonus Points!
2+ years experience (video gaming, e-commerce, consumer entertainment, etc.)
Experience with Python, JavaScript, Java or other programming language 
A passion for playing world class mobile, social and casual games a huge plus
Experience in making world-class social/casual/casino games a huge plus
If you’re serious about joining our Puzzle Studio and you enjoy solving problems, we’ll look first at people who can answer these 4 questions at this link: Senior Data Analyst Survey
",Media,4.5,2020-05-05,2020-06-05,FULL_TIME
18,"Director, Data Engineering",GSN Games,CA,San Francisco,100385,142606,"
GSN Games is looking for a Director of Data Engineering to be part of our team in San Francisco.
 
About the Data Team
The GSN Data team provides the data, analytics, and algorithms necessary to make GSN Games a fun and rich experience for players. We are building a next generation data platform and analytics suite to support the billions of records a day coming from our portfolio of gaming apps, databases, supporting web services, third party APIs, and everything in between. Our team supports key data platform, analytics and Machine Learning initiatives across the company.

What You’ll Do:
· Provide technical leadership to the GSN Data Engineering team (based in San Francisco) on key data initiatives for the company. This includes all aspects of data delivery, from ingestion, pipelining, data infrastructure, ETL and Machine Learning support
· Participate in design, implementation and deploying of full pipelines utilizing modern cloud data technologies (AWS Kinesis/Lambdas, Google Dataflow etc.) 
· Participate in strategic data initiatives across all studios
· Coordinate production and 24x7 support for all data products, with the support of a highly talented, international team of Data Scientists, Engineers and Analysts

About You:
· 7+ years of experience in Software Engineering, including several years in data
· Experience with managing Engineering teams of 5+ personnel, including mentoring, roadmapping, strategic planning and execution
· Experience with relational databases, NoSQL databases and end-to-end data pipeline architectures from ingestion through infrastructure, ETL and reporting/analytics layers 
· RESTful service design and implementation
· Strong experience with SQL, key DB Admin/ETL concepts 
· Strong familiarity (developing/supporting production level code) with at least two general purpose programming languages such as Python, Java, Scala, or C++
· Commitment to high quality software through automated tests and continuous integration 
· Experience working in agile environment
· BS/MS in Computer Science or similar

Bonus Points:
· Experience with Vertica a plus
· Experience with Google platform/tools such as BigQuery, Cloud Dataflow & Pub/Sub
· Experience in the gaming industry a plus 
Please review GSN Games's Privacy Notice ",Media,4.5,2020-05-05,2020-06-05,FULL_TIME
19,Data Scientist - Insights Modeling,The Play Station,CA,San Mateo,97620,157998,"Place to Play it s also the Best Place to Work. We ve thrilled g

since 1994, when we launched the original PlayStation. Today, we re

recognized as a global leader in interactive and digital entertainment. The

PlayStation brand falls under Sony Interactive Entertainment, a wholly-owned

subsidiary of Sony Corporation.

Data Scientist - Insights & Modeling

San Mateo, CA

The Global Store and Services (GSS) team are part of a vibrant organization

that manage both the transactional store and subscription businesses for

PlayStation. GSS brings together staff from around the world, with a passion

for engaging PlayStation gamers with relevant and entertaining content. This

area of Sony Interactive Entertainment has seen significant growth in recent

years to become a key revenue contributor and continues to evolve with the

industry to create new business opportunities. As the central analytics

organization within GSS, the Insights and Modeling team supports the commercial

operations for GSS based on data-driven insights and storytelling. The team

empowers the business with robust data analytics to effectively meet and exceed

their commercial objectives. We are looking for individuals who are motivated

by being part of a truly global team, working together at the forefront of

digital content distribution.

Reporting to the Manager, Data Science, the Data Scientist will be responsible

for shaping and running advanced analytics and modeling initiatives to support

the strategic direction of the Global Store and Services team. The Data

Scientist will focus on designing and executing statistical models to deliver

insights and recommendations to expand business opportunities.

The ideal candidate is an enthusiastic and flexible team player with a solid

technical skillset and strong analytical mind, is an excellent communicator,

and thrives in a fast-paced commercial environment.

Responsibilities

Work cross-functionally to define problem statements, collect data, and


apply statistics to complex business problems



Develop custom data models and algorithms; be a self-starter with a


passion for developing the best possible solution to the problem



Optimize statistical models and algorithms to identify insights that are


used to drive strategic decision-making across the organization



Use quantitative analysis and the presentation of data to see beyond the


numbers and understand what drives our business



Wrangle constantly changing, large, and complex data on users and various


forms of content using scripting and statistical tools such as SQL or

Python



Routinely communicate with stakeholders and leadership on modeling


projects; present in a cohesive, logical, and fluent way from the

original business question to data-driven strategy recommendation



Liaise with business teams within GSS to identify and evaluate


opportunity areas for advanced analytics initiatives



Collaborate with other Data Scientists and analytics teams in the wider


organization to drive business

Qualifications

5+ years experience in a commercially focused analytical role,


preferably in the digital retail and/or digital entertainment industry



Solid theoretical and practical understanding of Statistics (e.g.


hypothesis testing, experimentation, regressions)



Ability to take ambiguous problems and solve them in a structured,


hypothesis-drive, data-supported way



Proven track record of using data to drive business decisions with strong


analytical skills including the ability to structure problems for

analysis, analyze the data, and provide actionable recommendations



Strong verbal, written, and interpersonal communication skills with the


ability to articulate ideas and present complex analysis to non-technical

audiences



Demonstrated ability to work collaboratively across different functions
Ability to self-manage and balance multiple projects and priorities
Ability to initiate and drive projects to completion with minimal


guidance



Fluency in SQL and at least one statistical language: Python, R
Experience with analytical and visualization tools: Tableau,


MicroStrategy, Qlik, Looker, databox



Bachelor s Degree in a relevant technical or mathematical field
As the role is global, international travel will be required as well as a


flexible approach to working hours to support global business operations

Sony is an Equal Opportunity Employer. All persons will receive consideration

for without regard to race, color, religion, gender, pregnancy, national

origin, ancestry, citizenship, age, legally protected physical or mental

disability, covered veteran status, status in the U.S. uniformed services,

sexual orientation, gender identity, marital status, genetic information or

membership in any other legally protected category.

We strive to create an inclusive environment, empower employees and embrace

diversity. We encourage everyone to respond.

We sincerely appreciate the time and effort you spent in contacting us and we

thank you for your interest in PlayStation.

LI-SV1",Media,3.4,2020-04-30,2020-06-05,FULL_TIME
20,Senior Machine Learning Engineer,AppLovin,CA,Palo Alto,164202,279256,This company is in a hiring surge in response to COVID-19,Media,4.7,2020-04-25,2020-06-05,FULL_TIME
21,Data Analytics/ Data scientist,Sharpedge Solutions Inc,CA,Menlo Park,116415,143186,"JD:

Â Python for data manipulation & transformation (python dictionaries, data frames, data stream, joins of all kinds, outside of SQL IDEs)

Â Python modelling

Â Should have worked in designing, creating and defining Models.

Â Hands on experience in ML/DL/AI

Â Research skills â go figure it out and come back with working model. Pros/cons analysis skills

Â Must know SQL very well. Must understand relation and ER diagrams/normal forms.

Â How to design, create, extend/iterate, manipulate, seed with realistic data/data exploration, create and optimize queries, operate at low scale and high scale

Â Strong work ethic, independent problem solving skills, self-motivated, comfortable with startup culture

Â Excellent and crisp communicator

Please share resumes to bchitneedi@esharpedge.com",Media,4.7,2020-04-25,2020-06-05,FULL_TIME
22,Data Analyst - Consumer Experience,Sony Playstation Network,CA,San Mateo,95788,169574,"PlayStation isn't just the Best Place to Play -it's also the Best Place to Work. We've thrilled gamers since 1994, when we launched the original PlayStation. Today, we're recognized as a global leader in interactive and digital entertainment. The PlayStation brand falls under Sony Interactive Entertainment, a wholly-owned subsidiary of Sony Corporation.

Data Analyst - Consumer Experience

San Mateo, CA

What You Will Be Doing:

Data is central to PlayStation's decision-making process, and analysts are essential to driving data driven decisions throughout the organization.

Do you have a passion for data and deriving insights from large datasets?

As a Data Analyst, you will be working in a dynamic environment within the global Consumer Experience team where you will be leading the way for high quality, high velocity decisions for the team in a global environment!

Responsibilities:

Evangelize data knowledge and insights: handle communications with your partners and other teams both locally and globally, collaborate with both technical and non-technical colleagues to complete data projects and ensure all parties can use the insights to further improve
Maintain a customer-centric focus: strive to be a domain and product expert through data, develop trust among your peers and partners, and ensure that your team has access to data to make decisions
Prioritize and execute in the face of ambiguity: work with partners and mentors to distill the problem, adapt your tools to answer complicated questions, and identify the trade-offs between speed and quality of different approaches
Create analytical frameworks to measure team success: partner with cross-functional teams to define success metrics, create approaches to track the data and resolve errors, quantify and evaluate the data, then develop a common language for all colleagues to understand these critical metrics
Operationalize data processes - provide the team with ad-hoc analysis, automated dashboards, and self-service reporting tools so that everyone gets a good sense of the state of the business

Knowledge and Skill Requirements:

5 to 7+ years experience in analytics/data science roles
Experience in managing partners and distilling complex requirements into analytical solutions
Solid understanding of statistical analysis and experimentation, and capacity to drive conclusions from the analysis
Ability to work across disparate data sources to obtain sensible results
Bachelors or Master's degree in quantitative discipline (Economics, Finance, Statistics, Engineering, Computer Science or MBA with emphasis in analytics)
4+ years analyzing large multi-dimensional data sets using data/statistical tools such as R, Python, SAS, SPSS and Excel.
Experience utilizing tools like Tableau, HighCharts, Qlikview
Linux skills (shell scripting, Java, PHP, etc.)
A strong passion for data, charts, analysis, trends, and evangelizing data usage
Ability to draw conclusions from data and provide recommendations
Experience working and communicating within a global context
Experience with Salesforce Marketing and Service Cloud technologies
Data modeling skills with the ability to understand, create, and maintain data models
Presentation skills including creating Keynote/PowerPoint presentations


Sony is an Equal Opportunity Employer. All persons will receive consideration for employment without regard to race, color, religion, gender, pregnancy, national origin, ancestry, citizenship, age, legally protected physical or mental disability, covered veteran status, status in the U.S. uniformed services, sexual orientation, gender identity, marital status, genetic information or membership in any other legally protected category.

We strive to create an inclusive environment, empower employees and embrace diversity. We encourage everyone to respond.

We sincerely appreciate the time and effort you spent in contacting us and we thank you for your interest in PlayStation.",Media,3.4,2020-04-25,2020-06-05,FULL_TIME
23,Lead Data Scientist,Electronic Arts,CA,Redwood City,168641,218213,"We are EA

And we make games how cool is that? In fact, we entertain millions of people across the globe with the most amazing and immersive interactive software in the industry. But making games is challenging work. Thats why we employ the most creative, passionate people in the industry.

About the Role

The Lead Data Scientist is an important position in our Data Science team within the EA Studios organization at Electronic Arts, tasked with driving excellence and pushing innovation across EA. You will use your expertise in applied machine learning and artificial intelligence to guide essential decisions in a cross-functional environment. Our lead data scientist will directly help our games by developing complex and scalable data products.

As a technical lead, you will have opportunities for project management and mentoring of junior data scientists. The lead data scientist will work with producers across different game studios identifying new business opportunities, developing advanced customized algorithms to answer said questions, and conducting experiments to validate assumptions about said algorithms.

Come use your data superpowers for good and join us!Responsibilities

Develop meaningful relationships with partners throughout the studio organization to identify new opportunities for the team, both in addressing partners different pain points and proposing machine-learning-aided innovations to player experience.Research and build impactful data products that improve player experiences, driving them from conception, to experimentation, to productionization in-game.Contribute to the architecture and development of model deployment platforms, in particular providing guidance on automated model re-training, online training, scalability, failure recovery, updates with minimal downtime, model/pipeline versioning, performance monitoring.Stay up-to-date on latest developments in machine learning best practices, technologies, and research so as to expand the range of opportunities the team can handle.Guide technical projects and provide leadership through collaboration with game producers and central tech engineers.

Technical Qualifications

A PhD in Computer Science, Machine Learning, Artificial Intelligence, Statistics, or related quantitative field5+ years of experience applying data science/machine learning/deep learning methodologies to real-world problemsExpertise in analyzing extremely large, complex, multi-dimensional data sets with a variety of tools, including Python, SQL, and Spark. Experience with big data technologies, distributed data query and computing engine.Programming experience in a system programming language such as C/C++ or Java.Familiarity with at least one scripting language: R, Python, or ScalaExperience deploying machine learning systems using AWS, GCP, Virtual Machines, or Docker. Experience developing customizable, modular, and scalable deep learning algorithms in Keras/Pytorch/TensorflowResearch and design creative approaches to ambiguous problems, aiding in the implementation and scaling of these cutting edge systemsGood tracking record on collaborating with business and engineering team on long-term projects, pushing excellence in the rest of the data science organization

Personality Traits

Hypothesis driven uses data to test ideas rigorously and objectivelyWilling to teach and mentor colleaguesEager to stay on the cutting edge of methodologies and technologies
",Media,3.9,2020-04-28,2020-06-05,FULL_TIME
