,Job_title,Company,State,City,Min_Salary,Max_Salary,Job_Desc,Industry,Rating,Date_Posted,Valid_until,Job_Type
0,Data Engineer,Public Broadcasting Service,VA,Arlington,89383,104525,"
Data Engineer

Team: Business Intelligence Group
Status: Full-time/Exempt/Project (Funded by a grant for up to 3-years)
The Data Strategy and Operations team is charged with ensuring that data about PBS programs and audience is collected efficiently, reported accurately and closely aligned to specific business needs. As a Data Engineer you will join a team of professionals committed to delivering the data needed to empower a culture of decision-making that informs PBSs priorities and advances its mission to educate, inspire and entertain.
This role will serve as the primary technical resource for the Business Intelligence group. They will be in charge of defining, building and maintaining key data pipelines that feed into a variety of data products used by clients from across the company and the nation. The Data Engineer will be in charge of working with different internal groups, vendors and partners to identifying and obtain access to data sources. They will use that access to build automated processes (i.e. pipelines) that ingest and transform raw data into datasets that can be used to build visualizations, dashboards and analysis tools. Once these pipelines are built the developer will monitor them for data integrity and make incremental improvements to improve efficiency and performance and to reduce cost. This is a new position so we are looking for somebody who will be comfortable building a program from scratch with a keen focus on process, documentation and operational efficiency.

Essential duties will include, but not limited to:

Work with team members and key stakeholders to define deliverables, make estimates of effort, identify potential issues and propose timing for projects.
Design and create functional/technical specifications for efficient data models
Design and build custom extract, transform, load (ETL) data pipelines from multiple large data sources that result in concise data sets for business intelligence source tables.
Build custom connections from key API data sources.
Crafting and executing queries for data from databases and data warehouses upon request. When necessary scheduling/automating those jobs for the future.
Take an ownership role over the collection of accurate and clean data. Identify and manage data quality or integrity issues within the pipelines.
Modify existing solutions as necessary and continually evaluating their effectiveness and efficiency. Maintaining an enterprise business intelligence library and support the archiving of unused solutions.
Analyze BI infrastructure and technical issues to identify and implement new technologies that align with BI roadmap and make the system more flexible and scalable.
Support the process of data discovery by exploring and cultivating impactful data sets
Serve as liaison between the Business Intelligence and internal technical teams (IT, Digital Products, Technology and Operations) to ensure that enterprise product roadmaps include and deliver features and data needed for the BI roadmap
Assist with training and knowledge transfer of Data Engineer best practices to other staff members.

Requirements for success:


Bachelors degree in computer science, business intelligence or information systems technology preferred. An equivalent combination of education and work experience may be considered.
Technical training on at least one Business Intelligence tool; Domo experience ideal.
2+ years of experience building ETL workflows or data pipelines using Business Intelligence tools.
A deep understanding of APIs and how to obtain data from them.
Expert knowledge of how to build custom data-connectors for Business Intelligence tools; especially Domo.
Demonstrated knowledge of how to design and build automated Export, Transform, Load (ETL) processes or data pipelines.
Advanced knowledge of data structures, data modeling and data management.
Extensive experience with cloud data warehouses or relational/non-relational databases.
Ability to build and optimize advanced SQL queries.
Strong understanding of data privacy and data security best practices.
A familiarity with Google Cloud Platform and BigQuery
Experience with scripting languages such as R, Python or Javascript and any history with learning new languages is highly desirable.
A familiarity with digital analytics data sets such as Google Analytics
A deep desire to learn emerging skills and/or programming languages that improve Business Intelligence through automation.
Ability to effectively prioritize work, staying focused on primary objectives and always seeking to leverage existing work.
Highly organized and detail-oriented obsessive about efficiency and documentation

PBS is an Equal Opportunity Employer of Minorities, Women, Protected Veterans, and Individuals with Disabilities
",Media,3.8,2020-04-28,2020-06-06,FULL_TIME
1,Senior Data Scientist,"Discovery Communications, Inc.",MD,Silver Spring,123596,201900,"Position Summary

Our Team

The Global Data & Advanced Analytics (GDA) team enables Discovery to turn data into action. Using big data platforms, data warehousing and business intelligence technology, audience data, advanced analytics, data science, visualization, and self-service analytics, this team supports global company efforts to increase revenue, drive audiences, and enhance consumer engagement. Join a team that supports high impact business partners by leveraging data to drive innovation.

The Role As part of a growing team that is innovating the way Discovery does business around the world, the Senior Data Scientist/Statistician will be responsible for executing high impact data science projects to support our Ad Sales, Finance, Research, and Media business partners. These efforts will include optimization of revenue, viewership, engagement, retention, content value, and customer value for multiple media platforms. Specifically, you'll be responsible for developing and operationalizing mathematical/statistical analyses, hypothesis tests, and algorithms/models. You'll also be responsible for refining and executing operationalized algorithms and models.

You'll need to be an innovative forward-thinker who will help lead end-to-end execution of data science projects and contribute directly to existing and emerging business strategies and goals. Communication and ability to work in a collaborative team environment are essential.

You'll work with the Data Science Sr. Manager, data & analytics team, data engineering team, and business stakeholders to develop, refine, and scale data products. Therefore, this role requires strong technical and communication skills, creativity and attention to detail, and experience executing end-to-end data science projects-from use case definition to final product delivery.

Responsibilities

Apply data mining techniques to cleanse and explore large, complex data sets in preparation for further analysis2. Apply appropriate data reduction, feature selection, and feature engineering techniques3. Develop and implement hypothesis tests4. Develop, validate, and operationalize appropriate mathematical and statistical algorithms and models5. Review, make enhancements to, and execute operationalized algorithms and models6. Develop data products to communicate insights to internal stakeholders7. Communicate insights from analyses to internal stakeholders in clear business terms8. Assist in making data science techniques approachable and understandable to non-data scientists9. Collaborate with data & technology teams to create repeatable processes and scalable data products10. Identify appropriate data science solutions as new data-centric business problems arise 11. Stay current with new data science methods, technologies, and industry trends12. Support Data Science Sr. Manager in developing and implementing data science processes and best practices

Requirements

Master's or PhD degree in a quantitative field (statistics, physics, computer science, etc.) * Minimum of 3-5 years proven business experience and technical expertise in data science * Experience cleansing and preparing large, complex datasets for analysis* Expertise applying statistics or machine learning in a professional or other intensive problem-solving environment with large, complex datasets* Experience with hypothesis testing, regression & classification, time series analysis, & optimization* Expertise in statistical programming languages such as R or the Python scientific stack (NumPy, SciPy, scikit-learn, etc.)* Experience with Amazon Web Services (RedShift, S3, EC2, EMR, etc.) and Apache Spark preferred* Experience with SQL and NoSQL databases* Familiarity with data visualization tools, like Tableau* Strong analytical, critical thinking, and problem solving skills* Excellent communication skills-ability to present complex information in a concise and compelling manner* Ability and eagerness to learn and teach others* Prior media or direct-to-consumer industry experience preferred
Must have the legal right to work in the United States


silver spring, maryland, md",Media,3.4,2020-05-07,2020-06-06,FULL_TIME
2,Senior Data Scientist - Entertainment and Media Industry Opportunity,Discovery Communications,MD,Silver Spring,123596,201900,"Position SummaryOur Team

The Global Data & Advanced Analytics (GDA) team enables Discovery to turn data into action. Using big data platforms, data warehousing and business intelligence technology, audience data, advanced analytics, data science, visualization, and self-service analytics, this team supports global company efforts to increase revenue, drive audiences, and enhance consumer engagement. Join a team that supports high impact business partners by leveraging data to drive innovation.

The Role

As part of a growing team that is innovating the way Discovery does business around the world, the Senior Data Scientist/Statistician will be responsible for executing high impact data science projects to support our Ad Sales, Finance, Research, and Media business partners. These efforts will include optimization of revenue, viewership, engagement, retention, content value, and customer value for multiple media platforms. Specifically, youll be responsible for developing and operationalizing mathematical/statistical analyses, hypothesis tests, and algorithms/models. Youll also be responsible for refining and executing operationalized algorithms and models.

Youll need to be an innovative forward-thinker who will help lead end-to-end execution of data science projects and contribute directly to existing and emerging business strategies and goals. Communication and ability to work in a collaborative team environment are essential.

Youll work with the Data Science Sr. Manager, data & analytics team, data engineering team, and business stakeholders to develop, refine, and scale data products. Therefore, this role requires strong technical and communication skills, creativity and attention to detail, and experience executing end-to-end data science projectsfrom use case definition to final product delivery.

Responsibilities

Apply data mining techniques to cleanse and explore large, complex data sets in preparation for further analysis
Apply appropriate data reduction, feature selection, and feature engineering techniques
Develop and implement hypothesis tests
Develop, validate, and operationalize appropriate mathematical and statistical algorithms and models
Review, make enhancements to, and execute operationalized algorithms and models
Develop data products to communicate insights to internal stakeholders
Communicate insights from analyses to internal stakeholders in clear business terms
Assist in making data science techniques approachable and understandable to non-data scientists
Collaborate with data & technology teams to create repeatable processes and scalable data products
Identify appropriate data science solutions as new data-centric business problems arise
Stay current with new data science methods, technologies, and industry trends
Support Data Science Sr. Manager in developing and implementing data science processes and best practices

Requirements

Masters or PhD degree in a quantitative field (statistics, physics, computer science, etc.)

Minimum of 3-5 years proven business experience and technical expertise in data science

Experience cleansing and preparing large, complex datasets for analysis

Expertise applying statistics or machine learning in a professional or other intensive problem-solving environment with large, complex datasets

Experience with hypothesis testing, regression & classification, time series analysis, & optimization

Expertise in statistical programming languages such as R or the Python scientific stack (NumPy, SciPy, scikit-learn, etc.)

Experience with Amazon Web Services (RedShift, S3, EC2, EMR, etc.) and Apache Spark preferred

Experience with SQL and NoSQL databases

Familiarity with data visualization tools, like Tableau

Strong analytical, critical thinking, and problem solving skills

Excellent communication skillsability to present complex information in a concise and compelling manner

Ability and eagerness to learn and teach others

Prior media or direct-to-consumer industry experience preferred

Must have the legal right to work in the United States",Media,3.4,2020-05-06,2020-06-06,FULL_TIME
3,Data Engineer,"ZeniMax Media, Inc.",MD,Rockville,62986,81374,"Global video game publisher/developer headquartered in Rockville, MD, seeks a Data Engineer. This position works within the Enterprise Bl Team and is responsible for the development of the Data Platform for Enterprise wide reporting. The Data Engineer will be supporting a broad range of data pipelining needs from all facets of the business, including e-commerce, financial, and game event data. The incumbent will have relevant experience manipulating, organizing, storing, and processing data with a major programming language. The Big Data Engineer will facilitate the creation of data pipeline processes to move data from enterprise data sources such as relational databases and log files for data analysts and data scientists.Work within the Enterprise Bl team, supporting the creation of data pipeline processes for ingesting data at large scalesWork directly with Data Architects, Analysts, and Data ScientistsDirectly work with Data Engineers and Data Modelers to understand the source and target structuresCoordinate with the analysts and report developers to ensure data can be easily digested by Business Intelligence toolsBe able to straddle differing subject areas such as in game vs business data sources2+ Years of Experience with a major programming language (Scala, C++, Java, etc.)A clear understanding of both row and columnar storage databasesStrong SQL skills - able to query data sources and generate results from complex structuresExperience with relational databasesComfortable working with structured, semi-structured, and unstructured source dataStrong communicator - comfortable interfacing directly with differing customers across the organization in addition to the Bl teamBS degree in Computer Science, Computer Systems Engineering, or equivalentApache Spark experience a major plus (Spark RODs, Spark DataFrames, Spark SQL)Streaming Data Technologies (Pub/Sub, Kafka, Kinesis, etc)Experience with the Spark / Hadoop Eco-System (Hive, Parquet)Understanding of Amazon Web Services, Google Cloud Compute, or Microsoft AzureExperience with nonrelational databases or NoSQL Databases encouragedExperience working with very large datasets highly encouragedWorking experience with an agile development frameworkA personal interest in video gaming is a plus CCPA Applicant Privacy Notice",Media,3.4,2020-05-02,2020-06-06,FULL_TIME
4,Data Platform Engineering Manager,Gannett,VA,McLean,59246,102681,"Friday, April 17, 2020

Gannett Co., Inc. (NYSE: GCI) is an innovative, digitally focused media and marketing solutions company committed to strengthening communities across our network. With an unmatched reach at the national and local level, Gannett touches the lives of nearly 140 million people monthly with our Pulitzer-Prize winning content, consumer experiences and benefits, and advertiser products and services. Gannett brands include the USA TODAY and more than 260 daily local newspaper brands, digital marketing services companies ReachLocal, WordStream, and ThriveHive and U.K. media company Newsquest. There's never been a better time to join our talented team. Visit Gannett.com/Careers to learn more about our opportunities, and visit Gannett Privacy Policy to understand our privacy policy.

Data Platform Engineering Manager

Position SummaryGannett is seeking a Manager for our Data Platform team, focused on operating our cloud-based Big Data platform, as well as building new data initiatives for the USA TODAY NETWORK. As part of the Subscription and Data Products group, the team sits centrally within the organization and implements big data and cloud based data warehouse solutions to support our marketing and advertising operations and generating user profile data to be used by our more than 400 reader-facing products.

ResponsibilitiesAs the Manager of the Data Platform team, you will have responsibility for the daily operations and management of the platform and the team. You will work directly with the department director, as well as fellow development managers and key stakeholders in Product, Strategy, Marketing and Revenue. Specific responsibilities will include:



 Provide daily management of the team of 10 Hadoop engineers and ETL developers

 Working with the department Director, set strategy and roadmap for the continued evolution of Gannett’s data platform

 Closely collaborate with other department managers in overlapping areas

 Act as point of contact for external teams

 With the aid of the department Project Manager, run agile sprints delivering incremental value, while continuing to ensure operational excellence

 Based on your experience as a Data Engineer, manager of a Data Warehouse team or similar experience, deliver personal leadership within the team and across the organization in the respective field

 Mentor, retain, and help recruit team members as needed



Our ExpectationsThe Manager should be able to draw upon their past experience to provide effective operational leadership of our team. As such we are looking for:



 Proven track record of management, or positions leading up to management as the next natural career step

 Extensive, proven knowledge of Data Warehousing technologies, or Big Data (Hadoop and related technologies), either as a Data Warehouse or Big Data manager, or as a Big Data engineer or as a Data Scientist

 Experience with and appreciation for cloud hosting and Dev Ops in a Linux environment

 Solid general architectural skills, with proven experience in delivering complex data systems

 Proven knowledge in all stages of the software development life cycle, including the need for architecture, code reviews, unit and integration testing, CI and CD.

 Excellent written and verbal communication skills with the ability and desire to effectively communicate with all stakeholders including senior leadership.

 8+ years of experience

 Bachelor or Masters degree, preferably in Computer Science



Additional ConsiderationsWe'd be delighted if you also had experience with the following:



 JIRA and Confluence

 Google Cloud Platform

 Streaming data processing

 Data Governance

 Working with and developing solutions for media-related websites or publishers

#Product

#LI-MH1

Gannett Co., Inc. is a proud equal opportunity employer. We are a drug free, EEO employer committed to a diverse workforce. We will consider all qualified candidates regardless of race, color, national origin, sex, age, marital status, personal appearance, sexual orientation, gender identity, family responsibilities, disability, education, political affiliation, or veteran status.
Other details


 Job Family

 Audience Platform

 Job Function

 Technology

 Pay Type

 Salary

 Job Start Date

 Monday, September 16, 2019



",Media,3.0,2020-04-25,2020-06-06,FULL_TIME
